{
 "m1_slip": {
  "coefficients_LR_A": [
   {
    "feature": "cat__sector_Aviation & Aviation Infrastructure",
    "value": 0.6364
   },
   {
    "feature": "cat__sector_Coal",
    "value": -0.6641
   },
   {
    "feature": "cat__sector_Construction",
    "value": -0.6725
   },
   {
    "feature": "cat__sector_Education",
    "value": -0.7035
   },
   {
    "feature": "cat__sector_Electricity Generation",
    "value": 0.6541
   },
   {
    "feature": "cat__sector_Energy Storage",
    "value": -0.5104
   },
   {
    "feature": "cat__sector_Healthcare",
    "value": -0.3453
   },
   {
    "feature": "cat__sector_Inland Waterways",
    "value": -0.466
   },
   {
    "feature": "cat__sector_Logistics Infrastructure",
    "value": -0.1144
   },
   {
    "feature": "cat__sector_Metals & Mining",
    "value": 0.0821
   },
   {
    "feature": "cat__sector_Oil & Gas",
    "value": 0.5367
   },
   {
    "feature": "cat__sector_Railways",
    "value": -0.8696
   },
   {
    "feature": "cat__sector_Real Estate",
    "value": 0.4265
   },
   {
    "feature": "cat__sector_Roads & Highways",
    "value": 1.9227
   },
   {
    "feature": "cat__sector_Shipping",
    "value": -0.9584
   },
   {
    "feature": "cat__sector_Steel",
    "value": 0.5091
   },
   {
    "feature": "cat__sector_Telecommunication",
    "value": 0.3682
   },
   {
    "feature": "cat__sector_Tourism, Hospitality & Wellness",
    "value": -0.5352
   },
   {
    "feature": "cat__sector_Transmission & Distribution",
    "value": 0.4659
   },
   {
    "feature": "cat__sector_Urban Public Transport",
    "value": -0.5106
   },
   {
    "feature": "cat__sector_Waste & Water",
    "value": 1.4452
   },
   {
    "feature": "cat__sector_Water Resources",
    "value": -0.951
   },
   {
    "feature": "cat__state_Andaman & Nicobar",
    "value": 0.716
   },
   {
    "feature": "cat__state_Andhra Pradesh",
    "value": 0.0572
   },
   {
    "feature": "cat__state_Andhra Pradesh Project Name (Agency) (Project Code) (Legacy OCMS Code) Rehabilitation and Up-gradation of Pasarlapudi to Dhindi section from Km 105/170 to Km 126/510 of NH -214 New NH -216 to two lane with paved shoulder in the state of Andhra Pradesh under NHDP-IV (MoRTH) (618237) (N24000969) Rehabilitation and Up-gradation of Thimmapuram to Gurajanapalli section from Km 26/150 to Km 41/161 of NH - 214 New NH - 216 to two lane with paved shoulder in the state of Andhra Pradesh under NHDP-IV (MoRTH) (618238) (N24000964) Rehabilitation & Upgradation of NH214New NH-216 from Km 34/230 to Km 84/550 Losari to Machavaram Section to two lane with paved shoulder in the state of Andhrapradesh under NHDP-IV through Engineering, Procurement& Construction EPC mode. (MoRTH) (618239) (-) Construction of Paderu bypass Km 0000 to Km 13000 of 2- lane with paved shoulder on NH-516E (MoRTH) (618254) (N24002148) Two laning with paved shoulders of Lambasingi to Paderusection of NH 516E (MoRTH) (618255) (N24002142) Rehabilitation and Upgradation to 2-lane with paved should ders Sir, configuration of Chaprathipalem to Lambasingi section Km 165500 to Km 205000 of NH-516E in the State of Andhra Pradesh under Green National Highways Corridor Project GNHCP with the loan assistance of World Bank on EPC mode (MoRTH) (618256) (N24001958) Rehabilitation and Upgradation to 2-lane with paved shoulders configuration of Koyyuru to Chaprathipalem section Km 120000 to Km 165500 of NH-516E in the State of Andhra Pradesh under Green National Highways Corridor Project GNHCP with the loan assistance of World Bank on EPC mode (MoRTH) (618257) (N24001957) Two laning with paved shoulders of Gondiguda to Araku uptoBhallaguda section of NH 516E (MoRTH) (618258) (N24001956) Two laning with paved shoulders of Paderu to GundigudaSection of NH 516E (MoRTH) (618259) (N24001386) Construction of i Connecting Road from Z-Morh Tunnel to Zojila Tunnel Road Length 18.475km and ii 14.150 Km long 2-L Bi-directional single tube Zoji-la Tunnel across Zojila Pass on Sonamarg - Kargil section from Km 82 to Km 118 of NH-01 under PMDP (NHIDCL) (618412) (N24001256) Bangalore Chennai Expressway Phase-II Pkg-II from km.96.000 to Km 127.000 Baireddypalle to Bangarupalem section (National Highways Authority of India [NHAI]) (618475) (N24001985) Bangalore Chennai Expressway Phase-II Pkg-III from km.127.000 to Km 156.000 Bangarupalem to Gudipala section (National Highways Authority of India [NHAI]) (618476) (N24001821) Construction of 6 lane elevated corridor including its approaches from Km. 629880 to Km. 634470 Design Chainage of NH-16 in Ranasthalam Town portion in the state of Andhra Pradesh on EPC Mode under NHO. (National Highways Authority of India [NHAI]) (618524) (-) Construction of flyover at Gammon Junction at Km.903.265 on NH16 including vent at Diwancheruvu junction at Km.902.308 Blackspot ID No.AP03299 in Andhra Pradesh on EPC mode under NHO (National Highways Authority of India [NHAI]) (618525) (-) 6L of Gundugolanu Design km 1023.280 to Kalaparru Design km 1050.680 of NH-5 New NH-16 (National Highways Authority of India [NHAI]) (618526) (-) Six Laning of Vijayawada Bypass from Gollapudi to Chinnakakani in Vijayawada - Gundugolanu Section from km. 30.00 to km. 47.881 Pkg-IV (National Highways Authority of India [NHAI]) (618527) (N24001301) 6L of Anandapuram Pendurthi Anakapalli Section from km. 681.000 to km. 731.780 of NH-16 (National Highways Authority of India [NHAI]) (618579) (-) Nandigama Bypass and Kanchikacherla bypass (National Highways Authority of India [NHAI]) (618629) (-)",
    "value": -0.4731
   },
   {
    "feature": "cat__state_Arunachal Pradesh",
    "value": -0.7514
   },
   {
    "feature": "cat__state_Assam",
    "value": -0.4955
   },
   {
    "feature": "cat__state_Bihar",
    "value": 0.2865
   },
   {
    "feature": "cat__state_Chhattisgarh",
    "value": -0.083
   },
   {
    "feature": "cat__state_Dadra & Nagar Haveli and Daman & Diu",
    "value": -0.1528
   },
   {
    "feature": "cat__state_Delhi",
    "value": -0.3104
   },
   {
    "feature": "cat__state_Goa",
    "value": -0.0334
   },
   {
    "feature": "cat__state_Gujarat",
    "value": 0.2368
   },
   {
    "feature": "cat__state_Gujarat Project Name (Agency) (Project Code) (Legacy OCMS Code) Construction of Additional Structures including Approaches in Vadodara Surat Section of NH48 between existing Km. 108.000 to Km. 250.000 (National Highways Authority of India [NHAI]) (618508) (-) 6L with PS of Samakhiyali to Santalpur section from km. 339.700 to Km. 430.100 of NH-27 (National Highways Authority of India [NHAI]) (618564) (-) Sanchore - Santalpur from km 67.000 - km 99.000 of NH-754K AJ-RGBS-Package-3 (National Highways Authority of India [NHAI]) (618614) (N24001790) Sanchore - Santalpur from km 99.000 - km 130.073 of NH-754K AJ-RGBS-Package-4 (National Highways Authority of India [NHAI]) (618615) (N24001794) 4L of Dhrol bypass section of NH-151A Approx. length 5.7 Km & widening upto 4 laning of missing link of Amran section of NH-151A Approx. length 6.55 Km from existing Ch. 42000 to 48500 of ongoing Dhrol-Bhadra-Pipaliya section of NH-151A (National Highways Authority of India [NHAI]) (618616) (-) Pipli Bhavnagar-Package 1 from km 136.025 to km 169.328 (National Highways Authority of India [NHAI]) (618699) (-) Upgradation to 4L PS from Bhimasar, Junction of NH-41 to Anjar- Bhuj upto Airport Junction from Km 0.000 to Km 65.478 of NH-341 (National Highways Authority of India [NHAI]) (618787) (N24001785) Kodinar - Veraval Package VI from km. 221.610 to km. 263.00 of NH-8E & km. 120.900 to km. 121.150 of NH-8D (National Highways Authority of India [NHAI]) (618833) (N24000592) 4L Kodinar - Veraval Package VI from km. 222.400 to km. 230.00 Kodinar Bypass of NH-8E NH 51 new (National Highways Authority of India [NHAI]) (618834) (N24001827) 4L of Bal Works of Talaja - Mahuva from 54.990 km. to 100.450 km. of Old NH-8E Package-II (National Highways Authority of India [NHAI]) (618835) (N24001792) 4L PS Divided Carriageway from Patan Near Rajpur to Gojariya From Km 52.000 to Km 128.940 of NH-68 (National Highways Authority of India [NHAI]) (618901) (-) 4L PS from Ch. 94.030 in Jabugam Village to Ch. 132.320 in Dhamasiya Village of NH-56 Pkg-III (National Highways Authority of India [NHAI]) (618930) (-) 4L PS from Ch. 179.780 in Bitada/Movi Village to Ch. 208.900 in Nasarpore Village of NH-56 Pkg-V (National Highways Authority of India [NHAI]) (618931) (-) Construction of 4 lane with PS Idar-Badoli bypass section from design km 81/300 to km 95/500 of NH 168G in the State of Gujarat (MoRTH) (619061) (-) 6L of Chiloda-Naroda section from Km. 540.595 to Km. 555.595 of NH-8Package-VII (National Highways Authority of India [NHAI]) (619067) (-) Widening to 6L of Existing 4L Jetpur - Gondal - Rajkot Section from Km. 117.600 to Km. 185.00 on NH-27 (National Highways Authority of India [NHAI]) (619087) (N24002035) Four Laning of Una to Kodinar from km. 180.478 to km. 221.610 Package-V (National Highways Authority of India [NHAI]) (619145) (-) Kagvadar - Una Package-IV (National Highways Authority of India [NHAI]) (619146) (N24000569) 4L of Bal Works of Mahuva to Kagvadar from 100.450 Km. to 140.470 Km. of NH-8E Pkg- III (National Highways Authority of India [NHAI]) (619147) (N24001793) 4L of Bhavnagar - Talaja Package-I from Km. 6.945 to Km. 54.990 of Old NH-8E (National Highways Authority of India [NHAI]) (619148) (-) Delhi-Vadodara Greenfield Alignment NH-148N Pkg-27 Ch.729.700 to Ch.756.052 (NHAI) (619197) (-)",
    "value": -0.3555
   },
   {
    "feature": "cat__state_Haryana",
    "value": 0.2495
   },
   {
    "feature": "cat__state_Himachal Pradesh",
    "value": 0.1709
   },
   {
    "feature": "cat__state_Jammu and Kashmir",
    "value": 0.2459
   },
   {